;texto;classificacao
324;balanco do dia 16082021   006   acidentes  008   veiculos envolvidos  006   feridos  000   mortos   414   pessoas fiscalizadas 328   veiculos fiscalizados 020   testes de alcoolemia  345  notificaces de autuacao 001   pessoas detidas;0
325;ocorrer em nossas escoltas resguardando nossos policiais e toda a sociedade nao so na prevencao de acidentes mas tambem tentando minimizar ao maximo os efeitos nocivos deles  seguimos incansaveis na missao de servir e proteger;0
326;acidente com onibus do cantor devinho novaes na br 101 em al deixa saxofonista morto  via ;0
327;prf identifica e prende motorista que atropelou policial e fugiu em mariliasp  o acidente foi dia 17 de maio a vitima era um prf  leia o artigo completo em ;0
328;colisao mata duas pessoas na br 101 em santa catarina  acidentedetransito estradas transporte santacatarina;0
329; acidente com obito e varias vitimas na sc 108 no km 40 da rodovia em guaramirim o condutor que causou o acidente estava alcoolizado e acabou detido o acidente ocorreu por volta das 19h30 deste domingo 26 ;0
330;atropelamento por moto av anace 526 campo limpo 1 vit mascadultoescoriaces pelo corpoest  ;0
331;segundo a prf antes de acidente que quase atropelou funcionario em novembro de 2021 motorista havia atropelado garcom em 2020 apos se irritar com bar fechado  g1 maringa;0
332; informativo dnit  o dnit informa que a faixa esquerda da via marginal e a faixa direita da pista principal da br 101 serao  interditadas em pontos especificos ao longo do segmento das obras complementares e remanescentes da referida rodovia viaduto de ponta negra a pium;0
333;bombeiro no mangabeira shopping evita acidente com crianca na escadarolante ;0
334;tombamento 3008 alca de acesso do contorno sul de curitiba para br 277 rodovia do cafe  tombamento de carreta  trafego lento no local proximo a plasticos do parana na orleans sentido campo largo  1157 grupobr277 ;0
335; mesmo os motoristas mais cautelosos podem se distrair com uma chamada ou mensagem de texto esse lapso de concentracao ativado por uma notificacao enquanto voce verifica o celular pode ser fatal e resultar em acidentes gravissimos;0
336; rodovia joao cereser sp 360 em jundiai tem lentidao proximo ao entroncamento com a anhanguera local tem interdicao de faixa para implantacao de marginais sol predomina em todo o corredor dom pedro de rodovias e nao ha registro de acidentes;0
337;colisao de carro com moto deixa uma pessoa morta na sp 171   estradas saopaulo tansporte motos;0
338;0007 atencao em caso de acidente ou emergencia ligue 0800 071 3233 telefone atendimento 24hs;0
339;acidente envolvendo moto e carro na estr do campo limpo sent bairro transito ruim e vitima ja sen  ;0
340;noticia dois lobos guaras morrem atropelados em rodovia paulista num intervalo de 21 dias  ;0
341;o que aconteceu e lamentavel diz fogaca sobre acidente no potenza truckbrasil jr1  noticias;0
342;transito e mais carregado neste fim de tarde somente em campinas natural do horario de pico nao ha acidentes e tampouco chove em todo o corredor dom pedro ;0
343;acesso liberado a paulinia pelo km 126 da rodovia prof zeferino vaz local estava interditado por conta tombamento de um caminhao na rotatoria da avenida dr roberto moreira fora da area de concessao ;0
344;modelo mineira morre em acidente na br 277 em sao jose dos pinhais no parana   influencer parana estradas;0
345;transito e intenso no entroncamento da d pedro i sp 065 com a anhanguera em campinas tipico do fim de tarde  nao ha registro de acidentes e as obras que eram realizadas nesta segunda ja foram encerradas ;0
346;08h00   bom dia se beber nunca dirija evitar acidentes tambem e com voce mas se acontecer ligue pra gente 191  ;0
347;1745 atencao em caso de acidente ou emergencia ligue 0800 071 3233 telefone atendimento 24hs;0
348;dia 04032021  008 acidentes 013 veiculos envolvidos 006 feridos 000 mortos 274 pessoas fiscalizadas 237 veiculos fiscalizados 251 autos de infracao 001 pessoa detida 001 veiculo recuperado;0
349;transito e bom em todo o corredor dom pedro motorista desenvolve boa velocidade mesmo nos pontos em obras tarde comeca com tempo estavel e sem acidentes ;0
350;a rodovia ayrton senna tem trafego lento do km 19 ao 12 em direcao a sao paulo  reflexo de acidente;0
351;noticia anta morre atropelada em rodovia que corta parque estadual paulista  ;0
352;apos reducao de radares acidentes ficam mais letais em viagens de ano novo  via ;0
353;quando for necessario reduzir a velocidade procure nao acionar os freios de uma vez faca a frenagem de forma gradativa e evite acidentes ;0
354;sem acidentes de gravidade nas rodovias federais do rs;0
355; atencao   interdicao na alca de acesso da br 262 a br 050 em uberaba mg devido a tombamento de carreta equipes da concessionaria no local;0
356;balanco do dia 20072021  05 acidentes  12 veiculos envolvidos  00 mortos  06 feridos  171 veiculos fiscalizados  204 pessoas fiscalizadas  03 testes de alcoolemia  159 autos de infracao;0
357;analisando os fatos atropelamentos de fauna impacto nada seletivo nesta semana onca veado gato maracaja e tamanduas  ;0
358;1200 atencao em caso de acidente ou emergencia ligue 0800 071 3233 telefone atendimento 24hs;0
359;20h20   no local ocorreu um atropelamento de pedestre e pista esta interditada devido manifestantes ;0
360;balanco do dia 09022022 008 acidentes  015 veiculos envolvidos  006 feridos  002 mortos  335 pessoas fiscalizadas  304 veiculos fiscalizados  093 testes de alcoolemia  292 autos de infracao  026 veiculos recolhidos 000 pessoas detidas;0
361;cantor silvio brito apoia dia mundial em memoria das vitimas de transito atualmente ele comanda um programa aos sabados na    vitimasdetransito acidentesdetransito diamundial ;0
362; congestionamento na d pedro i se aproxima de 10km pista sentido jacarei tem interdicao de uma faixa no km 122 por conta de um acidente  bloqueio tambem impacta motorista que deixa o anel viario magalhaes teixeira sp 083 para acessar a pista sul da d pedro ;0
363;balanco do dia 13102021   009 acidentes  015 veiculos envolvidos  009 feridos  000 morto 304 pessoas fiscalizadas  257 veiculos fiscalizados  316 autos de infracao  030 veiculos recolhidos  001 veiculo recuperado  002 pessoas detidas;0
364;hoje 237 e o dia do policial rodoviario federal e amanha 24 a prf completa 92 anos queremos parabenizar a corporacao e agradecer o trabalho destes profissionais que garantem a seguranca das rodovias do pais e contribuem para a reducao de acidentes nas vias ;0
365;bom dia nos informe sobre chuva acidentes interdicao de vias e pontos de alagamento repassaremos para ouvintes e internautas;0
366;prf identifica reducao no numero de mortos e feridos nas rodovias federais piauienses durante o primeiro semestre do ano  a instituicao verificou que a principal causa de acidentes e a falta de atencao no momento de ingressar na rodovia ;0
367;pessoal a rodovia ayrton senna tem lentidao do km 41 ao km 42 sentido interior devido acidente demais trechos sob concessao  estao com trafego normal;0
368;acidente entre onibus e carreta deixa os dois motoristas mortos na br 101 em cristinapolis se  via ;0
369;jovem fica ferido apos colisao de moto e carro na al 115  alagoas maceio noticias ;0
370;o feriado da independencia foi mais uma tragedia anunciada nas rodovias brasileiras somente nas federais foram 1078 acidentes com 92 mortos e 1243 feridos sendo que muita gente nao viajou no feriado com medo de ficar retido na prometida greve dos caminhoneiros acidentes ;0
371;colisao de carro em poste na av protasio alves prox ao cruz c a r sao marcos no sent cen  eptcpoa;0
372;viaduto capitao temudo atropelamento de animal deixa transito muito complicado no sentido boa viagem evite se puder transitorecife;0
373;07h30   bom dia no momento nao ha ocorrencia relevante nas rodovias federais do es  dirijam com seguranca respeitem a sinalizacao e tenham todos uma boa viagem em caso de acidentes liguem prf 191  pm 190 samu 192  cbmes 193  eco101   0800 7701 101;0
374;atropelamento na av ipiranga prox ao numero 4107  agentes da eptc e samu em deslocamento  eptcpoa;0
375;acidente com tres veiculos deixa morto e feridos na fernao dias sp  jr24h jornaldarecord ;0
376;balanco do dia 10022022 03   acidentes 04   veiculos envolvidos 03   feridos 00   mortos 541 pessoas fiscalizadas 474 veiculos fiscalizados 429 autos de infracao;0
377;carro na contramao provoca acidente com uma morte e dois feridos na br 376 diz prf  g1 g1pr ;0
378;transito e lento no entroncamento da d pedro i sp 065 com a anhanguera em campinas reflexo do horario de pico de fim de tarde nao ha registro de acidentes no restante do corredor dom pedro transito flui bem neste fim de tarde ;0
379;balanco 08042021  acidentes 02 veiculos envolvidos 02 feridos 01 mortos 00 pessoas fiscalizadas 25 veiculos fiscalizados 19 autos de infracao 28 autuacao por alcoolemia 00 pessoas detidas 02;0
380;colisao na se 170 deixa uma mulher morta em campo do brito  via ;0
381;implantacao de um centro de formacao de condutores na prf do rio  a data de hoje e muito importante para a prf aqui no rio de janeiro em razao do convenio firmado com o detran que visa principalmente reduzir o numero de mortes nas estradas e facilitar o combate do crime org;0
382;transito intenso no km 144 da rodovia d pedro i proximo ao entroncamento com a anhanguera em campinas o km 7 do anel viario magalhaes teixeira sentido bandeirantes em campinas tambem apresenta grande fluxo de veiculos nao ha acidentes reportados ;0
383;12h20   prf identifica e detem motorista que atropelou idoso e fugiu na br 101 em rio novo do sules  o atropelamento ocorreu as 06h30 de hoje 05 o veiculo se evadiu e o atropelado veio a obito no local o motorista nao parou para prestar socorro   ;0
384;acidente entre dois caminhes interdita sentido da br 376 em guaratuba  g1 g1pr ;0
385;idoso morre em acidente no cariri quando ia fazer hemodialise em campinagrande ;0
386;acidente que matou marilia mendonca completa umasemana ;0
387;o anel viario em campinas tem congestionamento na pista sentido d pedro i a partir do km 10 um tombamento de veiculo foi registrado no km 5 altura da sanasa motorista nao se feriu concessionaria atua no local para liberacao da faixa;0
388;sem acidentes relevantes ou interdices nas rodovias federais no rio grande do sul ;0
389;no hge uma das vitimas do acidente na fernandes lima segue intubado e em estado grave veja imagens do motorista  alagoas maceio noticias ;0
390;quatro pessoas ficam feridas em acidente na br 277 em nova laranjeiras  g1 g1pr ;0
391;morre mais uma vitima de acidente provocado por bancario na fernandes lima em maceio  alagoas maceio noticias ;0
392;acidente entre 2 carros na av abrasil prox ao cruz c a av francisco trein no sent  eptcpoa;0
393;idoso morre apos ser atropelado por moto em campina grande  ;0
394;motorista provoca acidente fatal na sc 418 em sao bento do sul no km 59300 da rodovia e foge sem prestar socorro as vitimas o condutor de uma motocicleta que vinha no sentido contrario acabou se chocando em um poste a passageira da moto de 19 anos acabou nao resistindo ;0
395; dia nasceu ensolarado por todo o corredor d pedro   o transito na manha e mais denso em alguns pontos da rodovia d pedro i o km 114 da professor zeferino vaz em campinas proximo ao acesso de barao geraldo tem trafego lento  nao ha acidentes reportados ;0
396;balanco do dia 24042021  02 acidentes com feridos 01 acidente sem vitimas 04 veiculos envolvidos 02 feridos  52 pessoas fiscalizadas 51 veiculos fiscalizados 12 veiculos recolhidos 01 pessoa detida 55 autos de infracao;0
397;br116   km 779 planalto local onde houve o acidente finalizado trafego normal;0
398;0846 atencao em caso de acidente ou emergencia ligue 0800 071 3233 telefone atendimento 24hs;0
399;transito e mais carregado natural do horario de pico no entroncamento da d pedro i com a anhanguera em campinas   nao ha registro de acidentes neste fim de tarde e as obras que eram realizadas hoje ja foram encerradas  ;0
400;1850 colisao entre 2 carros na rotatoria av juca batista x r do schneider   agentes da eptc em desloca  eptcpoa;0
401;8h35  br381 fernao dias saida de bh ate saida para o triangulo com varios engavetamentos deixam transito lento atencao;0
402;acidente fatal a pmrv atendeu na manha desta terca feira 25 um grave acidente no km 36425 da sc 350 no municipio de aurora no local os policiais constataram que se tratava de um acidente tipo colisao transversalfrontal envolvendo um caminhao vw8160 e um vwpolo ;0
403;acidente grave envolvendo carreta na av ibirama taboaodaserra via intarditada linhas sao judas to  ;0
404; animais soltos geralmente ocasionam acidentes graves nas rodoviais por isso e importante trafegar na velocidade regulamentar e estar atento as surpresas este cavalo foi retirado da pista na manha desta quarta feira 14 em sao jose ele estava no km 2500 da sc  281 ;0
405;fins de semana acidentes de transito matam mais do que a covid em campina grande  ;0
406;estradas mineiras tem 19 mortes em 226 acidentes no feriado prolongado  via ;0
407;acidente fatal por volta das 21h desta quinta 3 na sc 355 km 145250 em jabora ocorreu um acidente fatal foi uma colisao frontal envolvendo um mbsprinter com placas de concordia e uma hondanxr 150 com placa de jabora o condutor da moto de 46 anos morreu no local;0
408;mae e filha de 3 anos sao encontradas mortas no rio tocantins sobre a ponte porto nacional  estradas acidentedetransito acidente acidentedetransito tocantins;0
409;as ultrapassagens proibidas sao as principais causas das colises frontais   entao dirija consciente e lembre sempre de uma coisa muitos acidentes podem ser evitados ;0
410;acidente em mina de carvao mata 11 pessoas  recordnews ;0
411;iniciamos as 00h de hoje 30 a operacao ano novo 2021 nas rodovias federais que cortam o es   reforcando que ha previsao de chuva para o final de semana e o feriado com a pista molhada aumenta muito a chance de acidentes entao redobre a atencao e diminua a velocidade ;0
412;talvez voce ja tenha visto essa imagem com legendas diversas nas redes sociais talvez um furacao um grave acidente na verdade se trata de uma cena de um filme conheca a historia ;0
413;trecho da raposo tavares tem reducao de mortes   saopaulo estradas acidentedetransito;0
414;motociclista tem parte da perna amputada em acidente com carro na al 110 em arapiraca  alagoas maceio noticias ;0
415; tempo segue nublado em todo o corredor dom pedro chove fraco em alguns pontos transito flui bem e nao ha registro de acidentes neste inicio de tarde ;0
416;a rodovia d pedro i sp 065 tem pequena lentidao no trecho de valinhos para quem segue sentido campinas por conta da interdicao de faixa para recuperacao do pavimento no km 120 nao ha acidentes neste inicio de tarde demais pontos em obras nao causam reflexos no transito ;0
417;trafego lento na rodovia ayrton senna do km 24 ao 25 pista local devido acidente no retorno do km 25;0
418;acidente entre carro e moto na r capitao andre lago paris x r cel aparicio borges   eptc em deslocame  eptcpoa;0
419;colisao na rodovia dos agricultores em artur nogueira sp mata homem e deixa gravida ferida  via ;0
420;entenda como o triangulo de seguranca ou triangulo de sinalizacao aumenta a visibilidade de quem esta com o veiculo impossibilitado de prosseguir diminuindo o risco de um acidente dentro do outro acesse   detranpeoficial semananacionaldetransito ;0
421;no transito lembre se e responsabilidade dos veiculos maiores prezarem pelos menores e os motorizados pelos nao motorizados quando for dirigir leve a empatia com voce estradasemacidentes maioamarelo ;0
422;homem morre e outro fica ferido preso as ferragens em capotamento na al 110  alagoas maceio noticias ;0
423;acidente entre 2 caminhes na sc 417 contorno sul de garuva proxima a fabrica de trator rodovia trancada em ambos os sentidos   primeiras informaces obito no local ;0
424;balanco do dia 17112021  003 acidentes  004 veiculos envolvidos  003 feridos  000 morto  672 pessoas fiscalizadas  863 veiculos fiscalizados  156 autos de infracao  001 veiculo recuperado 018 testes de alcoolemia;0
425;nesta sexta feira 075 os policiais militares do comando rodoviario da brigada militar estao intensificando as fiscalizaces nas rodovias estaduais em todo o estado no combate a criminalidade e na prevencao de acidentes ;0
426;rs   br 101290 acidente no entroncamento das br 101 e 290 em osorio sentido porto alegre provoca congestionamento de alguns quilometros   ha registro de lentidao tbm devido obras na br 101 em aguape acesso a morro alto sentido osorio;0
427;o risco de sofrer uma colisao dirigindo sob efeitos do alcool e alto inclusive com baixas concentraces no sangue  o risco aumenta consideravelmente quando a concentracao e de 004 gdl ou mais  suasegurancanossaprioridade viabahia ;0
428;transito e bom no corredor dom pedro nesta manha nao ha acidentes e o tempo e estavel  obras de hoje   d pedro i sp 065 igarata  km 33 sentido jacarei valinhos  km 115 sentido campinas   eng constancio cintra sp 360 jundiai  km 69 sentido anhanguera ;0
429; um caminhao com sucata tombou na alca de quem deixa a pista sul sentido jacarei da d pedro i para pegar a prof zeferino vaz sentido barao geraldopaulinia motorista teve ferimentos leves ha interdicao parcial da alca o que provoca lentidao na marginal da d pedro i ;0
430;07h30   prf inicia operacao finados 2021 nas rodovias federais do espirito santo  durante todo o feriado prolongado a instituicao reforcara o policiamento ostensivo em locais e horarios de maior incidencia de acidentes graves e de criminalidade   ;0
431;jovem e socorrido por policiais militares apos sofrer acidente com moto em trecho da al 130 em pao de acucar  alagoas maceio noticias ;0
432;bh suspeito morre atropelado por onibus durante tentativa de furto testemunhas contaram a pm que o homem tentou pegar um objeto pela janela do coletivo e caiu embaixo do veiculo   portalr7 r7 jr24h jornaldarecord ;0
433;em teresinapi apos envolver se em acidente de transito sem vitimas condutor e preso pela prf na br 343 ao ser detectado o indice de embriaguez 15 vezes maior que o permitido ;0
434;acidentes em rodovias do distrito federal matam duas pessoas  via ;0
435;sc   br 101 trafego lento em pontos alternados entre picarras e balneario camboriu sentido sul  ha tambem registros de acidente no sentido sul e no sentido norte em itajai;0
436; olha quem apareceu apos dias chuvosos e nublados tempo e ensolarado nesta manha condices de trafego sao excelentes em todo o corredor dom pedro nao ha acidentes ;0
437;galera o trafego esta sendo desviado para a pista local a partir do km 21 sentido sao paulo a pista expressa segue com bloqueio no  km 20 em direcao a capital paulista devido acidente por isso ha lentidao desde o km 23 ;0
438;australia morre sexta crianca apos acidente com castelo inflavel    jornaldarecord jr24h ;0
439;motociclista morre na br 101 em barra velha sc  acidente motociclista motociclismo estradas santacatarina;0
440;empresaria arapiraquense morre em acidente automobilistico em pe  alagoas maceio noticias ;0
441;idosa e atropelada e arremessada apos carro invadir calcada em bh    jornaldarecord jr24h ;0
442;1729 atencao em caso de acidente ou emergencia ligue 0800 071 3233 telefone atendimento 24hs;0
443;atropelamento pela r rio verde 678  freguesia do o 03 vtrs  aguia 19 empenhadas 01 vtm grave   ;0
444;1855 colisao entre 2 veiculos no cruz da av panamericana x r guadalupe   agentes da eptc em deslocam  eptcpoa;0
445;ambulancia perde controle na pi 218 e provoca acidente com duas mortes  acidentedetransito estradas prf;0
446;acidente na br 116 em satuba em alagoas mata duas pessoas   estradas alagoas;0
447;carla daniel falou nas redes sociais sobre acidente tragico do publicitario sergio stamile portalcorreio ;0
448;idoso passou mal perdeu o controle de carro de luxo capotou e atingiu seis veiculos estacionados  g1 acidente;0
449;atencao acidente entre 2 carros na r nelson zang prox ao numero 123   agentes da eptc no local   eptcpoa;0
450;grave acidente na br 020 entre onibus e carro deixa seis mortos em formosa go  via ;0
451;balanco do dia 23042021  03   acidentes 07   veiculos envolvidos 07   feridos 00   morto 241 pessoas fiscalizadas 282 veiculos fiscalizados 74   autos de infracao;0
452;voce sabia que o cinto de seguranca e o instrumento mais capaz de minimizar os danos em acidentes no transito nessa viagem lembre se de usa lo durante todo o percurso e ajude as pessoas ao redor a fazer o mesmo e simples rapido e salva vidas eco050 ;0
453;faixa da esquerda ja foi liberada no km 15 da rodovia ayrton senna sentido interior que estava bloqueada por conta de um acidente o trafego esta lento do km 12 ao km 15 ;0
454;prevencao a acidentes de transito nas rodovias mineiras    cprvbpmrv os anjos da guarda dos caminhos de minas    2021 50 anos cuidando da sua seguranca nos caminhos de minas  ;0
455;acidente aconteceu em santee cerca de 30 quilometros a nordeste do centro de san diego  g1;0
456;pedestre fica ferido ao ser atropelado por ambulancia em apucarana  g1 g1pr ;0
457;1637 colisao entre carro e moto na estr cristiano kraemer prox ao numero 720   agentes da eptc no l  eptcpoa;0
458;motociclista morre apos cair de moto e ser atropelado por carro na br 369 diz prf  g1 g1pr ;0
459;caminhoneira conhecida como musa das estradas diz que sofreu acidente a 40 kmh apos peca do caminhao da frente soltar  g1 ;0
460;05h40   bom dia  no momento nao ha ocorrencias relevantes ou interdices nas rodovias federais que cortam o espirito santo  em caso de acidentes ligue  prf 191 pm 190  samu 192  cbmes 193  eco 101   0800 7701 101;0
461; anel viario magalhaes teixeira sp 083 tem lentidao de 4km a partir do trevo de valinhos para o motorista que segue sentido d pedro i sp 065 mais cedo houve um acidente sem feridos no km 4 veiculos ja foram reposicionados no acostamento ;0
462;novo acidente na br 364 mata casal e deixa 5 feridos em vilhena ro  via ;0
463;1528 atencao em caso de acidente ou emergencia ligue 0800 071 3233 telefone atendimento 24hs;0
464;0405 atencao em caso de acidente ou emergencia ligue 0800 071 3233 telefone atendimento 24hs;0
465; ola danilo vou verificar mas acredito que nossos paineis eletronicos estejam avisando sobre o acidente;0
466;3007 alca de acesso do contorno sul para br 277 rodovia do cafe na orleans em curitiba acidente a prf esta no local trafego lento apos a volvo outro acidente proximo ao max atacadista 1655 grupobr277 ;0
467;colisao de carro em poste na av baltazar de oliveira garcia prox c a estrada antonio severino no se  eptcpoa;0
468; indignado deve ficar quem for vitima de um acidente gerado por uma irresponsabilidade desta;0
469;acidente com seis veiculos na br 290 deixa dois mortos em gravatai rs  via ;0
470;manha e com transito tranquilo no corredor dom pedro mesmo nos pontos em obras dia e ensolarado e sem acidentes  pontos com interdices   d pedro i campinas km 135 sentido jacarei jacarei km 14 e 5 sentido dutra   joao cereser jundiai km 65 e 63 sentido anhanguera ;0
471;0517 atencao em caso de acidente ou emergencia ligue 0800 071 3233 telefone atendimento 24hs;0
472;de janeiro a julho de 2021 mpt recebeu 17 denuncias de acidentes de trabalho  alagoas maceio noticias ;0
473;sargento da policia rodoviaria de minas e atropelado durante atendimento a acidente na br 135 e tem perna amputada  via ;0
474;acidentes de transito sao considerados pela organizacao mundial de saude oms como uma doenca nao transmissivel provocando mais mortes do que a tuberculose e o hivaids  saiba mais em   oms acidentesdetransito  ;0
475;balanco operacional do dia 02052021 retificado 12 acidentes 18 veiculos envolvidos 14 feridos 03 mortos 44 pessoas fiscalizadas 38 veiculos fiscalizados 04 teste de alcoolemia 52 autos de infracao 01 autos de alcoolemia 03 pessoas detidas 01 veiculo recuperado;0
476; acidente fatal registrado no fim da manha deste domingo 19 na sc 112 altura do km 29650 em rio negrinho  foi um acidente envolvendo um caminhao e uma motocicleta kawasaki versys o condutor da moto foi encaminhado ao hospital e a caroneira acabou perdendo a vida ;0
477;na br 232 km 211 em pesqueira as 19h30 020521 perimetro urbano uma motocicleta honda cg 150 colidiu frontalmente num carreta scaniar 440 a6x4 o motociclista homem de 30 anos morreu no local;0
478;noticia lobo guara morre atropelado em rodovia paulista  ;0
479;transito flui bem em todo o corredor dom pedro semana comeca com tempo mais fechado mas nao chove nao ha acidentes nesta manha  ;0
480;transito flui bem em todo o corredor dom pedro mesmo nos pontos em obras nao ha acidentes neste inicio de tarde ;0
481;transito flui bem e nao ha acidentes tempo e ensolarado na maior parte do corredor dom pedro  confira os pontos em obras   d pedro i igarata  km 14 e km 18 sentido jacarei valinhos  km 121 sentido campinas   eng constancio cintra jundiai  km 77 sentido anhanguera ;0
482;sem acidentes nas rodovias federais que cortam a rmbh chove em todo o trecho cuidado redobrado;0
483;transito livre no corredor dom pedro nao ha acidentes e tempo e bom na maior parte do trecho   obras hoje nos seguintes pontos  d pedro i  jacarei km 7 sentido campinas igarata km 23 sentido campinas  nazare km 43 sentido campinas valinhos km 121 sentido jacarei ;0
484;homem morre em colisao entre carro e caminhao na sp 310  via ;0
485;transito e intenso na altura do trevo de barao geraldo para o motorista que vem de paulinia pela prof zeferino vaz e no entroncamento da d pedro i  com a anhanguera tambem em campinas  excesso de veiculos ocorre por conta do horario de pico nao ha registro de acidentes ;0
486; a rodovia d pedro i tem lentidao no trecho de valinhos para o motorista que segue sentido campinas pista tem faixa interditada para obras no km 122  no restante do corredor dom pedro transito flui bem nao ha acidentes neste inicio de tarde e tempo e estavel ;0
